{
  "version": "1.0",
  "docType": "presentation",
  "docTypeName": "汇报材料",
  "title": "XX集团国企改革阶段总结",
  "sender": "XX集团",
  "recipient": "",
  "date": "2026年7月4日",
  "sections": [
    {
      "heading": "背景",
      "level": 1,
      "content": "2024年初，XX集团正式启动新一轮国有企业改革。经过两年多的推进，公司在股权结构优化、法人治理完善、三项制度改革等方面取得了阶段性成果。现将改革工作进展情况汇报如下：",
      "sourceMaterials": [
        {
          "author": "张三（综合办）",
          "originalText": "XX国企改革阶段总结-张三（综合办）\n\n咱们公司这一轮国企改革从2024年初启动到现在，已经走过了两年多的时间。总的来说进展还是不错的。具体来说：\n\n1. 股权结构优化方面，我们引入了3家战略投资者，混改工作基本完成。原来的国有独资变成了现在的多元化股权结构，国有股占比从100%降到了51%。\n\n2. 法人治理结构方面，董事会从7人扩充到11人，其中外部董事4人，独立董事2人。建立了6个专门委员会。监事会也进行了改组，现在有3名职工监事。\n\n3. 三项制度改革：中层管理人员竞聘上岗率达到85%，员工绩效考核覆盖率达到95%。薪酬差异化系数达到2.5:1。\n\n但是也存在一些问题：部分子公司改革进度不均衡，有的完成的快有的拖后腿。还有就是改革过程中有一些老员工思想包袱比较重，需要进一步做工作。\n\n下一步打算：继续深化三项制度改革，重点推进市场化经营机制。\n",
          "status": "adopted"
        }
      ]
    },
    {
      "heading": "主要做法",
      "level": 1,
      "content": "（一）股权结构优化与混合所有制改革\n1. 股权结构优化方面，我们引入了3家战略投资者，混改工作基本完成。原来的国有独资变成了现在的多元化股权结构，国有股占比从100%降到了51%。\n\n（二）法人治理结构完善\n2. 法人治理结构方面，董事会从7人扩充到11人，其中外部董事4人，独立董事2人。建立了6个专门委员会。监事会也进行了改组，现在有3名职工监事。\n\n（三）三项制度改革\n3. 三项制度改革：中层管理人员竞聘上岗率达到85%，员工绩效考核覆盖率达到95%。薪酬差异化系数达到2.5:1。\n\n（四）党建引领改革\n公司党委充分发挥把方向管大局保落实作用，成立由党委书记任组长的改革领导小组，下设5个专项工作组，先后召开12次党委常委会专题研究改革事项。坚持\"两个一以贯之\"，修订了党委会议事规则和\"三重一大\"决策制度。\n\n（五）内控制度建设\n编写人：赵六  风控合规部  2026.06\n",
      "sourceMaterials": [
        {
          "author": "张三（综合办）",
          "originalText": "XX国企改革阶段总结-张三（综合办）\n\n咱们公司这一轮国企改革从2024年初启动到现在，已经走过了两年多的时间。总的来说进展还是不错的。具体来说：\n\n1. 股权结构优化方面，我们引入了3家战略投资者，混改工作基本完成。原来的国有独资变成了现在的多元化股权结构，国有股占比从100%降到了51%。\n\n2. 法人治理结构方面，董事会从7人扩充到11人，其中外部董事4人，独立董事2人。建立了6个专门委员会。监事会也进行了改组，现在有3名职工监事。\n\n3. 三项制度改革：中层管理人员竞聘上岗率达到85%，员工绩效考核覆盖率达到95%。薪酬差异化系数达到2.5:1。\n\n但是也存在一些问题：部分子公司改革进度不均衡，有的完成的快有的拖后腿。还有就是改革过程中有一些老员工思想包袱比较重，需要进一步做工作。\n\n下一步打算：继续深化三项制度改革，重点推进市场化经营机制。\n",
          "status": "adopted"
        },
        {
          "author": "王五（党群工作部）",
          "originalText": "【党建与企业文化】材料汇总\n报送人：王五（党群工作部）\n时间：2026.6.28\n\n1.党建引领改革的情况\n\n    公司党委充分发挥把方向管大局保落实作用。成立了由党委书记任组长的改革领导小组，下设5个专项工作组。先后召开12次党委常委会专题研究改革事项。\n\n    坚持\"两个一以贯之\"，修订了党委会议事规则和\"三重一大\"决策制度，明确了党委在重大决策中的前置程序。\n\n2.干部队伍建设\n\n    完成中层管理人员调整优化，新提拔干部28人，轮岗交流干部35人。开展了3期专题培训，覆盖240人次。建立了干部能上能下机制，有5名干部因业绩不达标被降职或免职。\n\n3.职工思想动态\n\n    通过问卷调查（有效样本1860份），82%的职工对改革持积极态度，15%持观望态度，3%持消极态度。\n\n    针对思想包袱重的群体，党群工作部组织了16场座谈宣讲会和一对一谈心谈话380人次。\n\n4.企业文化融合\n\n    在混改过程中注重文化融合，开展了\"新XX人\"系列活动，包括：\n      -- 新老员工融合拓展活动4场\n      -- 企业文化大讨论2轮\n      -- 制定发布新版企业文化手册\n",
          "status": "adopted"
        },
        {
          "author": "赵六（风控合规部）",
          "originalText": "XX国企改革阶段性工作-风控合规部分\n编写人：赵六  风控合规部  2026.06\n\n一、制度建设方面\n建立健全内控制度体系，新制定制度23项、修订制度15项、废止制度8项。形成了以基本制度、管理办法、操作规程三级架构的制度体系。\n\n二、合规管理方面\n设立首席合规官，成立合规管理委员会。开展合规培训8场次、640人次。完成全集团合规风险排查，识别风险点127个，其中高风险18个、中风险42个、低风险67个。\n\n三、审计监督方面\n完成改革专项审计3项，发现问题17个，已整改完成14个，3个正在整改中。建立了审计问题整改台账，实行销号管理。\n\n四、安全生产方面\n改革期间安全生产形势持续稳定，连续28个月无重大安全事故。安全生产投入较改革前增长15%。\n\n五、下一步工作方向\n需要重点关注混改后关联交易合规性、新股东权利保障机制等新出现的合规领域。加强合规管理信息化建设。\n",
          "status": "adopted"
        }
      ]
    },
    {
      "heading": "工作成效",
      "level": 1,
      "content": "改革前后主要财务指标对比如下：\n\n表1：改革前后主要财务指标对比\n\n| 指标 | 改革前(2023年) | 2024年 | 2025年 | 增长率 |\n|------|---------------|--------|--------|--------|\n| 营业收入 | 28.5亿元 | 31.2亿元 | 35.2亿元 | 23.5% |\n| 净利润 | 1.8亿元 | 2.5亿元 | 3.6亿元 | 100% |\n| 资产负债率 | 72% | 68% | 64% | -8个百分点 |\n| 国有资产保值增值率 | 102% | 105% | 108.5% | +6.5个百分点 |\n\n注：数据经审计确认，增长率为改革前到2025年的累计增长。\n\n主要增收来源：\n- 新增战略投资者带来的业务协同效应约1.2亿元\n- 三项制度改革激发活力带来的人效提升贡献约0.8亿元\n- 市场化拓展贡献约2.7亿元\n\n表2：子公司盈利情况分类\n\n| 子公司名称 | 区域 | 2025年利润 | 同比变化 | 备注 |\n|-----------|------|-----------|---------|------|\n| XX科技 | 华东 | 0.85亿元 | +15% | 科技板块龙头 |\n| XX制造 | 华南 | 0.62亿元 | +8% | 传统优势板块 |\n| XX贸易 | 华北 | -0.12亿元 | 扭亏中 | 仍在培育期 |\n| XX物流 | 东北 | -0.08亿元 | 亏损扩大 | 需重点关注 |\n\n注：北方区域3家子公司（XX贸易、XX物流、XX能源）合计亏损0.32亿元。\n\n成本控制方面：\n管理费用率从12.3%降至9.8%，下降了2.5个百分点。\n人工成本占总成本比重保持稳定在22%左右。\n",
      "sourceMaterials": [
        {
          "author": "李四（财务部）",
          "originalText": "===国企改革财务效益分析=== 作者：李四（财务部）  2026年6月\n\n改革前后对比数据如下：\n\n表1：改革前后主要财务指标对比\n\n| 指标 | 改革前(2023年) | 2024年 | 2025年 | 增长率 |\n|------|---------------|--------|--------|--------|\n| 营业收入 | 28.5亿元 | 31.2亿元 | 35.2亿元 | 23.5% |\n| 净利润 | 1.8亿元 | 2.5亿元 | 3.6亿元 | 100% |\n| 资产负债率 | 72% | 68% | 64% | -8个百分点 |\n| 国有资产保值增值率 | 102% | 105% | 108.5% | +6.5个百分点 |\n\n注：数据经审计确认，增长率为改革前到2025年的累计增长。\n\n  主要增收来源：\n  - 新增战略投资者带来的业务协同效应约1.2亿元\n  - 三项制度改革激发活力带来的人效提升贡献约0.8亿元\n  - 市场化拓展贡献约2.7亿元\n\n表2：子公司盈利情况分类\n\n| 子公司名称 | 区域 | 2025年利润 | 同比变化 | 备注 |\n|-----------|------|-----------|---------|------|\n| XX科技 | 华东 | 0.85亿元 | +15% | 科技板块龙头 |\n| XX制造 | 华南 | 0.62亿元 | +8% | 传统优势板块 |\n| XX贸易 | 华北 | -0.12亿元 | 扭亏中 | 仍在培育期 |\n| XX物流 | 东北 | -0.08亿元 | 亏损扩大 | 需重点关注 |\n\n注：北方区域3家子公司（XX贸易、XX物流、XX能源）合计亏损0.32亿元。\n\n  成本控制方面：\n  管理费用率从12.3%降至9.8%，下降了2.5个百分点。\n  人工成本占总成本比重保持稳定在22%左右。\n\n  存在问题：\n  - 部分子公司盈利能力仍然偏弱，特别是北方区域的3家子公司仍然亏损\n  - 应收账款周转天数从45天增加到52天，需要加强回款管理\n\n  建议：\n  加强亏损企业治理，建立优胜劣汰机制；强化现金流管理\n",
          "status": "adopted"
        }
      ]
    },
    {
      "heading": "存在问题",
      "level": 1,
      "content": "但是也存在一些问题：部分子公司改革进度不均衡，有的完成的快有的拖后腿。还有就是改革过程中有一些老员工思想包袱比较重，需要进一步做工作。\n- 新增战略投资者带来的业务协同效应约1.2亿元\n- 三项制度改革激发活力带来的人效提升贡献约0.8亿元",
      "sourceMaterials": [
        {
          "author": "张三（综合办）",
          "originalText": "XX国企改革阶段总结-张三（综合办）\n\n咱们公司这一轮国企改革从2024年初启动到现在，已经走过了两年多的时间。总的来说进展还是不错的。具体来说：\n\n1. 股权结构优化方面，我们引入了3家战略投资者，混改工作基本完成。原来的国有独资变成了现在的多元化股权结构，国有股占比从100%降到了51%。\n\n2. 法人治理结构方面，董事会从7人扩充到11人，其中外部董事4人，独立董事2人。建立了6个专门委员会。监事会也进行了改组，现在有3名职工监事。\n\n3. 三项制度改革：中层管理人员竞聘上岗率达到85%，员工绩效考核覆盖率达到95%。薪酬差异化系数达到2.5:1。\n\n但是也存在一些问题：部分子公司改革进度不均衡，有的完成的快有的拖后腿。还有就是改革过程中有一些老员工思想包袱比较重，需要进一步做工作。\n\n下一步打算：继续深化三项制度改革，重点推进市场化经营机制。\n",
          "status": "adopted"
        },
        {
          "author": "李四（财务部）",
          "originalText": "===国企改革财务效益分析=== 作者：李四（财务部）  2026年6月\n\n改革前后对比数据如下：\n\n  营业收入：改革前（2023年）28.5亿元，2025年达到35.2亿元，增长23.5%\n  净利润：从1.8亿元增至3.6亿元，增长100%\n  资产负债率：从72%降至64%\n  国有资产保值增值率：108.5%\n\n  主要增收来源：\n  - 新增战略投资者带来的业务协同效应约1.2亿元\n  - 三项制度改革激发活力带来的人效提升贡献约0.8亿元\n  - 市场化拓展贡献约2.7亿元\n\n  成本控制方面：\n  管理费用率从12.3%降至9.8%，下降了2.5个百分点。\n  人工成本占总成本比重保持稳定在22%左右。\n\n  存在问题：\n  - 部分子公司盈利能力仍然偏弱，特别是北方区域的3家子公司仍然亏损\n  - 应收账款周转天数从45天增加到52天，需要加强回款管理\n\n  建议：\n  加强亏损企业治理，建立优胜劣汰机制；强化现金流管理\n",
          "status": "adopted"
        }
      ]
    },
    {
      "heading": "下一步打算",
      "level": 1,
      "content": "一是继续深化三项制度改革，重点推进市场化经营机制。\n二是加强亏损企业治理，建立优胜劣汰机制，强化现金流管理。\n三是重点关注混改后关联交易合规性、新股东权利保障机制等新出现的合规领域。",
      "sourceMaterials": [
        {
          "author": "张三（综合办）",
          "originalText": "XX国企改革阶段总结-张三（综合办）\n\n咱们公司这一轮国企改革从2024年初启动到现在，已经走过了两年多的时间。总的来说进展还是不错的。具体来说：\n\n1. 股权结构优化方面，我们引入了3家战略投资者，混改工作基本完成。原来的国有独资变成了现在的多元化股权结构，国有股占比从100%降到了51%。\n\n2. 法人治理结构方面，董事会从7人扩充到11人，其中外部董事4人，独立董事2人。建立了6个专门委员会。监事会也进行了改组，现在有3名职工监事。\n\n3. 三项制度改革：中层管理人员竞聘上岗率达到85%，员工绩效考核覆盖率达到95%。薪酬差异化系数达到2.5:1。\n\n但是也存在一些问题：部分子公司改革进度不均衡，有的完成的快有的拖后腿。还有就是改革过程中有一些老员工思想包袱比较重，需要进一步做工作。\n\n下一步打算：继续深化三项制度改革，重点推进市场化经营机制。\n",
          "status": "adopted"
        },
        {
          "author": "李四（财务部）",
          "originalText": "===国企改革财务效益分析=== 作者：李四（财务部）  2026年6月\n\n改革前后对比数据如下：\n\n  营业收入：改革前（2023年）28.5亿元，2025年达到35.2亿元，增长23.5%\n  净利润：从1.8亿元增至3.6亿元，增长100%\n  资产负债率：从72%降至64%\n  国有资产保值增值率：108.5%\n\n  主要增收来源：\n  - 新增战略投资者带来的业务协同效应约1.2亿元\n  - 三项制度改革激发活力带来的人效提升贡献约0.8亿元\n  - 市场化拓展贡献约2.7亿元\n\n  成本控制方面：\n  管理费用率从12.3%降至9.8%，下降了2.5个百分点。\n  人工成本占总成本比重保持稳定在22%左右。\n\n  存在问题：\n  - 部分子公司盈利能力仍然偏弱，特别是北方区域的3家子公司仍然亏损\n  - 应收账款周转天数从45天增加到52天，需要加强回款管理\n\n  建议：\n  加强亏损企业治理，建立优胜劣汰机制；强化现金流管理\n",
          "status": "adopted"
        },
        {
          "author": "赵六（风控合规部）",
          "originalText": "XX国企改革阶段性工作-风控合规部分\n编写人：赵六  风控合规部  2026.06\n\n一、制度建设方面\n建立健全内控制度体系，新制定制度23项、修订制度15项、废止制度8项。形成了以基本制度、管理办法、操作规程三级架构的制度体系。\n\n二、合规管理方面\n设立首席合规官，成立合规管理委员会。开展合规培训8场次、640人次。完成全集团合规风险排查，识别风险点127个，其中高风险18个、中风险42个、低风险67个。\n\n三、审计监督方面\n完成改革专项审计3项，发现问题17个，已整改完成14个，3个正在整改中。建立了审计问题整改台账，实行销号管理。\n\n四、安全生产方面\n改革期间安全生产形势持续稳定，连续28个月无重大安全事故。安全生产投入较改革前增长15%。\n\n五、下一步工作方向\n需要重点关注混改后关联交易合规性、新股东权利保障机制等新出现的合规领域。加强合规管理信息化建设。\n",
          "status": "adopted"
        }
      ]
    }
  ],
  "attachments": [
    "附件：改革主要指标对比表",
    "附件：子公司改革进度一览表"
  ],
  "notes": "",
  "complianceChecks": [
    {
      "type": "language",
      "location": "全文",
      "message": "检测到口语化表达\"拖后腿\"，建议改为规范书面语",
      "severity": "warning"
    },
    {
      "type": "language",
      "location": "全文",
      "message": "检测到口语化表达\"包袱比较重\"，建议改为规范书面语",
      "severity": "warning"
    }
  ],
  "customTemplate": null,
  "exportedAt": "2026-07-04T04:32:37.669Z"
}